{
  "baselineFile": "baseline.json",
  "candidateResultIds": [
    "indices-ra03",
    "indices-ra04",
    "indices-rg034-displayed",
    "indices-rv05-displayed",
    "coding-vs20",
    "coding-vs21",
    "coding-vs22",
    "coding-vs23",
    "coding-vs24",
    "coding-vs25",
    "coding-vs26",
    "coding-vs27",
    "coding-vs28",
    "coding-vs29",
    "coding-vs30",
    "coding-vs31",
    "coding-vs32",
    "coding-vs33",
    "coding-vs34",
    "coding-vs35",
    "coding-vs36",
    "coding-vs37",
    "coding-vs38",
    "coding-vs39",
    "coding-vs01",
    "coding-vs02",
    "coding-vs03",
    "coding-vs04",
    "coding-vs05",
    "coding-vs06",
    "coding-vs07",
    "coding-vs08",
    "coding-vs09",
    "coding-vs10",
    "coding-vs11",
    "coding-vs12",
    "coding-vs13",
    "coding-vs14",
    "coding-vs15",
    "coding-vs16",
    "coding-vs17",
    "coding-vs18",
    "coding-vs19",
    "coding-sc01",
    "coding-sc02",
    "coding-sc03",
    "coding-sc04",
    "coding-sc05",
    "coding-sc06",
    "coding-sc07",
    "coding-sc08",
    "coding-sc09",
    "coding-sc10",
    "coding-sc11",
    "coding-sc12",
    "coding-sc13",
    "coding-sc14",
    "coding-sc15",
    "coding-sc16",
    "coding-sc17",
    "coding-pr01",
    "coding-pr02",
    "coding-pr03",
    "coding-pr04",
    "coding-pr05",
    "coding-pr06",
    "coding-pr07",
    "coding-pr08",
    "coding-pr09",
    "coding-pr10",
    "coding-pr11",
    "coding-pr12",
    "coding-pr13",
    "coding-pr14",
    "coding-pr15",
    "coding-pr16",
    "coding-ps01",
    "coding-ps02",
    "coding-ps03",
    "coding-ps04",
    "coding-ps05",
    "coding-ps06",
    "coding-ps07",
    "coding-ps08",
    "coding-ps09",
    "coding-tb01",
    "coding-tb02",
    "coding-tb03",
    "coding-tb04",
    "coding-tb05",
    "coding-tb06",
    "coding-tb07",
    "coding-tb08",
    "coding-tb09",
    "coding-tb10",
    "coding-tb11",
    "coding-tb12",
    "coding-tb13",
    "coding-tb14",
    "coding-tb15",
    "coding-tb16",
    "coding-tb17",
    "coding-tb18",
    "coding-tb19",
    "coding-tb20",
    "coding-tb21",
    "coding-tb22",
    "coding-tb23",
    "coding-tb24",
    "coding-tb25",
    "coding-tb26",
    "coding-tb27",
    "coding-tb28",
    "coding-tb29",
    "coding-tb30",
    "coding-tb31",
    "coding-tb32",
    "coding-tb33",
    "coding-tb34",
    "coding-tb35",
    "coding-ds01",
    "coding-ds02",
    "coding-ds03",
    "coding-ds04",
    "coding-ds05",
    "coding-ds06",
    "coding-ds07",
    "coding-ds08",
    "coding-ds09",
    "coding-ds10",
    "coding-ds11",
    "coding-ds12",
    "coding-ds13",
    "coding-ds14",
    "coding-ds15",
    "coding-ds16",
    "coding-ds17",
    "coding-ds18",
    "coding-ds19",
    "coding-ds20",
    "coding-ds21",
    "coding-ds22",
    "coding-ds23",
    "coding-ds24",
    "coding-ds25",
    "coding-ds26",
    "coding-ds27",
    "coding-ds28",
    "coding-ds29",
    "coding-ds30",
    "coding-ds31",
    "coding-ds32",
    "coding-ds33",
    "coding-ds34",
    "coding-ds35",
    "coding-ds36",
    "coding-ds37",
    "coding-ds38",
    "coding-ds39",
    "coding-ds40",
    "coding-ds41",
    "coding-ds42",
    "coding-ds43",
    "coding-ds44",
    "coding-ds45",
    "coding-ds46",
    "coding-ds47",
    "coding-ds48",
    "coding-ds49",
    "coding-ds50",
    "coding-ds51",
    "coding-ds52",
    "coding-ds53",
    "coding-ds54",
    "coding-ds55",
    "coding-ds56",
    "coding-ds57",
    "coding-ds58",
    "coding-ds59",
    "coding-ds60",
    "agent-v-haiku-chart-no-tools",
    "agent-v-haiku-chart-tools",
    "agent-v-haiku-hle-no-tools",
    "agent-v-haiku-hle-tools",
    "agent-v-haiku-os-partial",
    "agent-zr-opus55-low",
    "agent-zr-opus55-medium",
    "agent-zr-opus55-high",
    "agent-zr-opus55-xhigh",
    "agent-zr-opus55-max",
    "agent-z-r1",
    "agent-z-r2",
    "agent-z-r5",
    "agent-z-r6",
    "agent-z-r7",
    "agent-z-r10",
    "agent-z-r11",
    "agent-z-r13",
    "agent-z-r15",
    "agent-z-r16",
    "agent-z-r17",
    "agent-z-r18",
    "agent-z-r19",
    "agent-z-r22",
    "agent-z-r23",
    "agent-z-r24",
    "agent-z-r25",
    "agent-z-r26",
    "agent-z-r27",
    "agent-z-r28",
    "agent-z-r30",
    "agent-z-r31",
    "agent-z-r33",
    "agent-z-r34",
    "agent-z-r35",
    "agent-z-r36",
    "agent-z-r37",
    "agent-z-r38",
    "agent-z-r39",
    "agent-z-r40",
    "agent-z-r41",
    "agent-z-r45",
    "agent-z-r46",
    "agent-z-r48",
    "agent-z-r50",
    "agent-z-r51",
    "agent-z-r52",
    "agent-z-r54",
    "agent-z-r56",
    "agent-z-r57",
    "agent-z-r58",
    "agent-z-r60",
    "agent-z-r61",
    "agent-z-r63",
    "agent-z-r65",
    "agent-z-r68",
    "agent-z-r69",
    "agent-z-r71",
    "agent-z-r72",
    "agent-z-r76",
    "agent-z-r78",
    "agent-z-r79",
    "agent-z-r81",
    "agent-z-r82",
    "agent-z-r86",
    "agent-z-r87",
    "agent-z-r88",
    "agent-z-r89",
    "agent-z-r94",
    "agent-z-r99",
    "agent-z-r102",
    "agent-z-r103",
    "agent-z-r104",
    "agent-z-r106",
    "agent-z-r108",
    "agent-z-r109",
    "agent-z-r113",
    "agent-z-r116",
    "agent-z-r117",
    "agent-z-r119",
    "agent-z-r122",
    "agent-z-r124",
    "agent-z-r126",
    "agent-os-b-0",
    "agent-os-p-0",
    "agent-os-b-1",
    "agent-os-p-1",
    "agent-os-b-2",
    "agent-os-p-2",
    "agent-os-b-3",
    "agent-os-p-3",
    "agent-os-b-4",
    "agent-os-p-4",
    "agent-os-b-5",
    "agent-os-p-5",
    "agent-os-b-6",
    "agent-os-p-6",
    "agent-os-b-7",
    "agent-os-p-7",
    "agent-os-b-8",
    "agent-os-p-8",
    "agent-os-b-9",
    "agent-os-p-9",
    "agent-os-b-spark13",
    "agent-os-p-spark13",
    "agent-os-b-spark12",
    "agent-os-p-spark12",
    "agent-h-opus48-high",
    "agent-h-k31-high",
    "agent-h-k3-high",
    "agent-h-g38-high",
    "agent-h-g37-high",
    "agent-h-g35",
    "agent-h-lite31-high",
    "agent-h-opus5-high",
    "agent-h-astra-high",
    "agent-h-sol56-high",
    "agent-h-sol56-xhigh",
    "agent-h-terra56-high",
    "agent-h-luna56-high",
    "agent-h-sparkopen-high",
    "agent-h-spark13-high",
    "agent-h-glm52",
    "agent-h-grok46",
    "agent-h-grok45",
    "agent-h-glm53",
    "agent-h-sol61-high",
    "agent-h-argon-high",
    "agent-a-astra-max",
    "agent-a-sol61-max",
    "agent-a-terra61-max",
    "agent-a-argon-high",
    "agent-a-wonderfull-max",
    "agent-a-k31",
    "agent-a-haiku55-max",
    "agent-a-grok47-xhigh",
    "agent-a-q0902",
    "agent-a-ds1017-max",
    "agent-a-glm53-max",
    "agent-a-g38-high",
    "agent-a-mimo26",
    "agent-a-m31",
    "agent-a-step5",
    "agent-a-luna6-max",
    "agent-a-sparkopen-xhigh",
    "agent-a-q27-xhigh",
    "agent-a-inkling-xhigh",
    "agent-c-argon",
    "agent-c-astra",
    "agent-c-opus55",
    "agent-c-sol6",
    "agent-c-fable51",
    "agent-c-sol56",
    "agent-c-g38",
    "agent-c-g37",
    "agent-c-fable5",
    "agent-c-g36",
    "agent-c-terra56",
    "agent-c-spark12",
    "agent-c-luna56",
    "agent-c-luna6",
    "agent-c-q38max",
    "agent-c-spark13",
    "agent-c-opus5",
    "agent-c-k3",
    "agent-c-grok46",
    "agent-c-q38flash",
    "agent-c-glimmer",
    "agent-c-grok45",
    "agent-c-sonnet5",
    "agent-c-glm53flash",
    "agent-c-opus48",
    "agent-c-q37plus",
    "agent-c-grok47",
    "agent-c-ds41",
    "agent-c-dsvision",
    "agent-c-lite35",
    "agent-c-inkling",
    "agent-c-inklingsmall"
  ],
  "evidenceFiles": [
    "evidence-indices.json",
    "evidence-coding-science.json",
    "evidence-agent-knowledge.json"
  ],
  "id": "benchmark-refresh-2026-10-28",
  "notes": "Pending candidates from the three retained staging inputs; staging is not a maintenance source. No approval or publication.",
  "schemaVersion": 1,
  "scopeFile": "models.json",
  "targetIds": [
    "aa-intelligence-index",
    "vals-index",
    "terminal-bench",
    "deepswe",
    "swe-bench-pro",
    "osworld",
    "automationbench",
    "hle",
    "gdpval-aa",
    "chartography",
    "terminal-bench-science"
  ]
}
